Id,title,idea,rating,labels,labels_viability,labels_feasibility,labels_desirability
37M4O367VJU9YD7JJZ5DSP8UMXQM5P,37M4O367VJU9YD7JJZ5DSP8UMXQM5P, Philanthropy driven by those who receive funds. This idea will benefit grantees and the constituents they serve. Ultimately the grantee will be the active participant in the proposed structure- acting on behalf of their mission and who they serve. If the recipient of funding can help to determine funding design- type- recipients- and amounts- the philanthropic deployment of funds will more effectively leverage transformation. The community will be the grantor and the involvement of grantee leaders will create more interconnectedness within the impact sector. There have been applications of this model through a process called Shared Gifting. This process has been in application on a smaller scale for decades. More here: http://rsfsocialfinance.org/shared-gifting/ The barriers to creating this model on a larger scale is buy in from funders- likely foundations. The funding sources have their priorities and directives but if the paradigm can shift to one which releases direction of granting to the community- access to capital could stand to benefit from a more inclusive process. Granting is a standard process to the majority - those with funds decide where funds go (even if based on research or experiment). It will be hard to change this paradigm. An organization,3,3,2,4,3
37OPIVELUUFKC5IPNYGH8VGKXPSHAH,37OPIVELUUFKC5IPNYGH8VGKXPSHAH, I'd like to contribute this idea as a PR strategy for our sponsors to utilize. A. Beneficiaries - High school students and their families. It's well documented that financial behaviors start in the family. Like AA (alcoholic anonymous) those with in poor financial condition have a difficult time admitting to the problem. Role models- professional athletes- 'coming out' can have moving impact on others admitting to their current situation.B. Professional Athletes - Thought leaders for change- using their notoriety to give back and educate.C. Sponsors - PR strategy High schools already serve as educational facilitators for local communities. However- there is an issue with gaining enthusiasm around 'personal finance' seminars and classes because well... they're boring- AND more importantly no one wants to admit they are confused by their finances. Given their celebrity status in light of their own money problems- athletes have the power to change the stigma associated with personal finance by being advocates for classes sponsored by local high schools. 1. Have a professional athlete visit their high school to speak about his/her money problems as an equal with the student body and their parents in attendance.2. Have the professional athlete advocate for weekly/monthly class that is sponsored by the high school.3. If this works- scale the operation with more professional athletes across high more high schools and establish a universal curriculum. I have a question and a request. First the question: Do you think professional athletes as advocates for financial education actually have the ability to mobilize those who need it the most? Why or why not?The request: I am seeking our sponsors to help scale this potential campaign (if they see fit). Assuming of course this works in an experimental condition- professional athletes as advocates for better personal finance education has the ability to scale nationally (globally). A group brainstorm,3,3,3,3,3
37VUR2VJ6A1X19U95N9NM3Q1G3HC1F,37VUR2VJ6A1X19U95N9NM3Q1G3HC1F, let each student become real investor Children learns how to earn earn money using money and it will open path to prosperity. A child will receive few bucks that he/she can use for anything but preferably invest in personal brokerage account. To motivate investment- a child will receive extra bucks for each dollar invested. All students will work together and to really earn money and help each other to learn and understadn how financial institutions work This can be done a single class in elementary or middle school.Within few months it can be evaluated whether student are engaged in the process of investing and whether this is a beneficial experience that can help them in the future. Need find cooperating brokerage company who is willing to create a special accounts for each childrenso they can really invest money. A student project or collaboration,2,2,2,3,2
382GHPVPHS3QG8V9ZCHORYTAMAE43M,382GHPVPHS3QG8V9ZCHORYTAMAE43M, Property owners providing free short term accommodation to those in need (e.g. victims of domestic violence) through channels like Airbnb. Existing property owners who already rent out part or all of their property could provide accommodation for free- as a form of (tax deductible?) donation to individuals and families needing short term accomodation and support following a personal/financial crises. This provides people with 'breathing space' in a safe environment to work out their financials and 'where to from here'. This taps into existing communities on site like Airbnb- private rental and couchsurfing sites. It focuses on close geographical communities (i.e. housing people from your own city) and could involve some kind of matching system so that property owners could support people of similar age- who have had a similar crises in the past etc. It could also be facilitated by charities/housing services to reduce risk and increase safety of both parties. Airbnb already offers something like this in the USA for people post a large natural disaster (e.g. Hurricane Sandy). This could be expanded to other countries and other accommodation sites. Input from people using sites like Airbnb as either a guest or a property owner. Input from people working at charities that require housing options for clients (e.g. charities dealing with domestic violence- new migrants- homelessness). This contribution started at the Melbourne OpenIDEO meetup. An OpenIDEO Meetup,4,4,4,4,5
389A2A304OUXUK9R945N8Y7RBBBC0C,389A2A304OUXUK9R945N8Y7RBBBC0C, Allowing those with the financial knowledge to share it with those who need it! It would benefit the immediate community these programs are located in. The main players are volunteers who would spend their time educating others of the concepts of financial responsibility. For example- they could go to high schools or community halls once a week to share their experiences- presenting real life examples rather than conceptual math classes. The volunteers would benefit because by teaching others- they would understand the material better as well as obtain new perspectives. The majority of the volunteers are ideally university students or professors (who are willing to dedicate their time to help others.) This may create a tighter network as each 'teacher' is trying to help someone in his/her community directly. In the long run- those who were initially learning could go on to become volunteers themselves in order to give back to their community- therefore creating a cycle that is constantly changing and evolving. Generation Citizen- a similar project in which volunteers go to local high schools to teach students about making a change in their community has seen some success in the east coast. Their core structure could act as a resource and a model that this new concept could follow. With GC's success in major cities such as Boston & Philadelphia- it does seem viable to assume that this concept could grow in big cities as well. It would be a great starting point if OpenIDEO could provide its network for the project. The first step would be to market what the project is and how it would work. Having a strong network will go a long way with a) getting the message to the public- b) obtaining the volunteers and gauging interest- and c) calculating if the project is feasible on a financial basis. An individual,2,2,1,4,3
39WICJI5AT46J5JYK57ELU6JN5H3ZX,39WICJI5AT46J5JYK57ELU6JN5H3ZX, Education through a tiered approach enabling children to gain financial stability. We wanted to develop a life-centered solution to improve the quality of life for the children- 10 to 15 years old- of Rio de Janeiro's Favelas- specifically Favela Rocinha. With this idea we will help teach children financial responsibility- help them develop resource management skills and empower them to play a part in the transformation of their community into prosperous neighborhoods. People in Brazil's Favelas already have an entrepreneurial spirit with in their communities. We want to encourage this community infrastructure and build from it. We will also engage the community with the promotion and distribution of the program. We would set up a small scale prototype within one of the schools or neighborhood facilities. Facilitating the partnerships. A student project or collaboration,3,3,2,4,4
3BFNCI9LYK2NZVDS1AFVUADKDC4739,3BFNCI9LYK2NZVDS1AFVUADKDC4739, Design informative note and included it with the legal papers before they are signed Peoplethat need to sign legal documents-they will have more information to make better decision The more information people have regard their legal documents the better their decisions will be- the better their decisions are the less financial trouble they will have . Design the informative note and partner with small legal farm to include the informative note with the documents- and then after given it to people ask for their feed back ! - Group brainstorm An individual,3,3,3,4,4
3CIS7GGG65VS745L32P2NTV1CCSEUA,3CIS7GGG65VS745L32P2NTV1CCSEUA, Peer lending network offering a borrowing alternative for those who can't obtain conventional loans; program infrastructure provided by CUs. This program would benefit individuals who cannot oftain a convential loan product from a bank /CU (perhaps due to lack of credit or poor credit). It would also benefit individual's who are interested in taking on more investment risk for a potentially higher yield. Finally- this programs could benefit CUs who would provide the program backbone (ensuring lending compliance- providing required documents- etc) as the CUs would realize a new revenue stream from the small service fees imposed. Leverging the burgoening growd sourcing movement- this new platform would bring borrowers and investors together from accross the nation/world to provide the funds needed to those who may lack other alternatives. By creating a community where individuals can invest in each other and offer collateral or security that may be unconvential by traditional standards- it creates new opportunities for the underserved. Group funding helps spread the risk and increases the likelihood of a loan being made. Surveying individuals on the likelihood of lending money to various individuals based on varying scenarios and circumstances. This would provide an opportunity to test potential investors appetite for risk and willingness to contribute varying amounts at varying interest yields. This could also provide an opportunity to test the impact that social currency of helping out someone in need has on individual's sense of accomplishment and resulting desire to contribute. It takes a community to build a community so i'd seek the OpenIDEO community to provide feedback on what they would value most from such a program (as a borrower or investor). I would determine the value of social currency- poll users to get a feel for risk tolerance- acceptable collateral- what role the CU industry could play to create a secure and trustworthy community where transactions could occur. Other,2,2,2,4,2
3D3B8GE8923YK368E5AML97RDYK9PZ,3D3B8GE8923YK368E5AML97RDYK9PZ, Financial advisors are often too expensive for those most in need of their services. Let's connect community members with students! This idea benefits those in need and students studying financing. Those in need can receive financial advice at a considerable lower rate than what they might pay a financial advisor. College students can charge a small fee and benefit from the real world experience of advising their community members. This idea connects those who have deep financial knowledge with those who don't. It empowers the community by making financial guidance more accessible and empowers those in school by helping them refine their expertise. We could see how willing community members might be to receive financial advice from college students and how willing student might be to refine their expertise in the real world. We could also explore price points/subscription models that are acceptable by all involved. An OpenIDEO Meetup,4,4,3,4,4
3DQYSJDTYLNKO8ZG870P70U56U9EX2,3DQYSJDTYLNKO8ZG870P70U56U9EX2, Give each beneficiary of food banks $10 and give them food each time after that only when they reproduce the $10. This idea benefits the 46.5 million people who use the service provided by Feeding America. The whole idea is to teach them to be financially independent thus eventually reducing the number of people depending on food banks. The beneficiaries can multiply the money using ideas around financial literacy which can be taught through various media such as flyers- camps- programs- etc. The disadvantaged demographic uses the Feeding America network on a regular basis to fulfill their food requirements. Each community can raise the funds needed to support this program so that the government does not have to bear the costs of running this initiative. The community can also help provide options to the disadvantaged people on how to multiply the $10 that they will receive. We can pilot this program in a single food bank to understand the feasibility of this project. Providing $10 to each individual who uses that food bank service and check whether they are utilizing the $10 to multiply the same. We can choose the bank that has a tight-knit community that supports the bank so that we can help more people to become financially sustainable. It will be interesting for me to know whether anyone in this community has tried something similar. I would also like to get suggestions around using money as a tool to foster accountability. Currently food banks provide food for free- but do you think giving money first and asking an individual to just retain the money over a period of time can teach her financial literacy? An individual,1,1,1,1,1
3DTJ4WT8BDR9T3ZV9POA4LAGEU7EZZ,3DTJ4WT8BDR9T3ZV9POA4LAGEU7EZZ, An app allowing parents to track their little sprouts financial literacy milestones - is my child on track? The app grows with your sprout This will help parents and children alike track their financial milestones - much like an app to ensure your child is accomplishing all of their developmental milestones. This app will allow users to keep there little sprouts on the right financial literacy track - not on track don't fret we have all the guides in place to connect you to the proper resources! Our challenge invites parents to come together as a community and share ideas- suggestions- what's working and more importantly what isn't. The app would provide forums searchable by key phrases such as how much does soccer camp cost? The app would grow with your sprout and connect parents by comparing their kids much like a development chart your child is in the 90th percentile for height and 60th percentile for weight. OpenIDEO Chicago could connect with a local school to review curriculum - what are kids REALLY learning about finical literacy? Once we obtain more information we would ask a verity of parents to attend an open forum night hosted by openIDEO - we would ask questions to better understand parental and child motivation for educating sprouts and what milestones they would be interested in their kids accomplishing. Ideally openIDEO Chicago would come up with a set of questions for other openIDEO communities to take to their local schools and/or parents. Do other regions- demographics- age groups want their children to learn different things or accomplish different goals? OpenIDEO Chicago would then synthesize the information and present it to the community in a concise format. An OpenIDEO Meetup,3,3,3,4,3
3EGKVCRQFW4BHAD63CK1P6VT53QBY5,3EGKVCRQFW4BHAD63CK1P6VT53QBY5, Make it easy for those with lower income to invest money for long term benefits. This idea generated from an article I read about the worth of the black woman. I was startled to know how many of us were not worth $5.However- for those that are in the lower level income bracket it becomes more crucial a task.So the demographics start with women who are making a living or less than a living wage and are still responsible for children. There are 1000s of organizations created to help women with getting jobs- financial literacy- and other issues that affect their lives.My approach is to teach them about savings and create a financial mechanism that will help them see the value of saving. The amount that I will ask for is $5.If I can reach 1-000-000 of us and show how $5 can grow I can inspire others to do the same. What I need is a mutual fund or bank that can help me run the program. Once I had the financial partner in place- I would be able to start with the Washington DC Metropolitan area with 100 women who are willing to invest in the fund. We would meet monthly- like an investment club- and watch the money grow. First- I need a financial partner who can advise me on creating the savings fund I envision. I would love to have partners who focus on women opportunities who can help me reach out to women and share the $5 Dollar Project.Everyone who believes in the idea is valuable as it could really change lives. An individual,1,1,2,4,1
3EHIMLB7F7B6THPAQ0W3C4AP71SH8D,3EHIMLB7F7B6THPAQ0W3C4AP71SH8D, A kickstarter-like campaign- but within your local community- that allows neighbors to give money using SMS- or with cash at a local store. For people who may not have access to bank accounts- credit cards or computers. And for those who do not have access to online crowdfunding tools. No computers needed! A group brainstorm,1,1,1,4,3
3EQPA8A3748H4JLNNQZ111N8J23JZP,3EQPA8A3748H4JLNNQZ111N8J23JZP, Create a platform that will enable financial awareness for children through neighborhood jobs This idea will benefit the community but primarily younger generations who are asked to identify opportunities within a neighborhood and then negotiate a price for the job. They will learn to be creative- entrepreneurial and financially responsible as they will gain a better understanding into the effort required to obtain compensation. This platform could work in all locations and demographics. The jobs would vary but the education taken from the experience would be life changing. Communities need a way for people to connect with one another beyond their immediate neighbors and offer up money making and financially educational opportunities to children or young adults so that they will learn these lessons earlier in life. The process would be to provide a platform for individuals to identify problems or jobs that are needed throughout the community. They would then approach the benefactor to negotiate a price for this service. From there the service could be provided. Gather our neighbors together and discuss the platform concept. We could then encourage the young people to seek out opportunities and begin to negotiate the importance and price of the service. This would help us better understand the needs of the platform before setting out on designing the solution to help facilitate the interaction. Feedback about how the solutions could be identified and captured. Testing the concept within different communities. Improving and iterations on the idea. Other,3,3,2,3,4
3FTID4TN8LANUJZIUP9V39RYHX4LY2,3FTID4TN8LANUJZIUP9V39RYHX4LY2, Encouraging communities to thrive with their own on-hand resources through a peer lending trust system. 1. communities with on-hand resources seeking financial empowerment; 2. individuals with savings looking for a alternative way to invest (lend) their money. This idea takes advantage of the dynamics in a community (i.e. trust- organization- cooperation) to make it an attractive alternative investment solution for individual around the world. In turn- communities have access to a new financial resources (the savings of individuals). Before launching any such platform- it is essential to test it on a micro-scale. Essentially- that means seeking out a local community with an on-hand resource looking for financial empowerment as well as a potential investor eager to help through investing. Testing the platform on a personal basis by word of mouth before launching it online is important. Discussing and getting feedback from the main players can insure a more successful system in the long run. How to improve the educational sector of my idea? What about the mediator/facilitators from the community- does that seem to have success? How to perfect and gap the holes in the idea? An OpenIDEO Meetup,2,2,1,4,3
3FTID4TN8LANUJZIUP9V39RYHX4LY2,3FTID4TN8LANUJZIUP9V39RYHX4LY2, Encouraging communities to thrive with their own on-hand resources through a peer lending trust system. 1. communities with on-hand resources seeking financial empowerment; 2. individuals with savings looking for a alternative way to invest (lend) their money. This idea takes advantage of the dynamics in a community (i.e. trust- organization- cooperation) to make it an attractive alternative investment solution for individual around the world. In turn- communities have access to a new financial resources (the savings of individuals). Before launching any such platform- it is essential to test it on a micro-scale. Essentially- that means seeking out a local community with an on-hand resource looking for financial empowerment as well as a potential investor eager to help through investing. Testing the platform on a personal basis by word of mouth before launching it online is important. Discussing and getting feedback from the main players can insure a more successful system in the long run. How to improve the educational sector of my idea? What about the mediator/facilitators from the community- does that seem to have success? How to perfect and gap the holes in the idea? An OpenIDEO Meetup,2,2,2,4,3
3FULMHZ7OU9R2U3J5UM3NX2GM1VM4K,3FULMHZ7OU9R2U3J5UM3NX2GM1VM4K, Each student would receive a salary based on performance- participation- and other school credentials to use for lunch and school store. This idea benefits the world because if young kids are educated about how to spend their money; they directly impact the future of our economy. The users would be parents- teachers- school employees- and the students- of course. This is targeting kids from K to 5th grade. The teachers would have to plan a system on the salary for each student and what are the factors that play into it. I think we could start in the public schools in Chicago or another big public school network. This idea is leveraging the family communities in big cities to bring together their kids- teachers- and parents. Usually kids learn about handling money in high school and by that point- it is too late because there will always be a divide in the financial health of each household. By learning the value of a dollar early on- the kids will gain insight on how to spend their money- what their needs are vs. their wants- and how to treat others equally. I could go to my old middle school or elementary school and try to test this idea out in one class. I could work with the teacher and the parents to come up with a salary system. Then the kids could just buy things during class and then we came move further to lunch or the school store. I need help to come up with a structured plan around this idea. When I was younger- I went to a children's museum in Chicago where there was a fake grocery store and I could pick out the things I wanted and go to the cashier. I had a limit based on the fake money I had. I want to emulate the same kind of experience every day for kids because it made the experience of money super fun!! An OpenIDEO Meetup,2,2,2,2,3
3G5RUKN2ECFYHIUVYQXUHK2WDJJ9N3,3G5RUKN2ECFYHIUVYQXUHK2WDJJ9N3, Keep your digital pet alive by saving money! This idea can assist many communities- from kids learning the importance of saving money for a rainy day or adults with bad financial habits. This concept allows for users to sympathize with their digital pets needs. The more you save the better healthier your pet will be. Our challenge focus on digital communities- we plan to focus our efforts on digital tacking- forums and comparisons. If your family is saving for a vacation- you can create a family pet. See who contributes more - the competitive nature might nourish some unexpected results. OpenIDEO Chicago would test a variety of user groups to see who is the best target market- as of know we know that kids enjoy and become addicted to games quickly. However with some thought- we also realize that teens and adults greatly enjoy games such as angry birds. Could we streamline the experience to fit a variety of folks. Make it harder to keep you pet alive as you grow older and make more money. We would love for ideas and observations from the openIDEO community. What challenges could we set in place to make the game more interesting - can we link the app to peoples bank and credit accounts? An OpenIDEO Meetup,4,4,4,4,4
