Id,title,idea,rating,labels,labels_viability,labels_feasibility,labels_desirability
3Q2T3FD0ONK6KYKF5GHKDSAA81ZM3Z,3Q2T3FD0ONK6KYKF5GHKDSAA81ZM3Z, See your old age nest egg grow This idea benefits the low income people who do not have enough disposable income to save for old age There should be a law mandating 8% payment to a pension account for every payment you make to a person not covered by a pension plan but forward thinking communities can implement this in their communities without waiting for a law We can take one ward in Delhi out of 272 and see what people think of the idea and how many individuals who use domestic help and how many businesses who have employees not covered by pension- pay the 8% pension. Is this idea unique or has this been done elsewhere. If it has been done elsewhere examples will help adoption in Delhi. An individual,1,1,1,1,1
3QGHA0EA0JC7S5I6OB2D49ADUVQBW6,3QGHA0EA0JC7S5I6OB2D49ADUVQBW6, Could reduction of pay inequality help build trust and subsequently empower those of lower economic class? This idea could primarily benefit people who are disenfranchised by the current levels of income disparity (at least from a U.S. perspective).I do believe that everyone could potentially benefit from this idea. By defining- and building- communities that include all economic classes I believe we can build trust (in both directions) between those who have financial knowledge and power and those who are more or less disenfranchised by current structures. Ben & Jerry's is one example of a company that tried to limit the ratio in pay between the highest paid employee and the lowest- but unfortunately that practice didn't survive the sale of the company.Other than seeking out other examples- I have to acknowledge that I'm not sure of a lightweight test. I think it would be important to try to quantify what would constitute an ideal amount of pay inequality and what the tradeoffs might be- if that can be done via appropriate research.I would also welcome ideas on how to facilitate building community and networks between high and low earners. Other,1,1,1,1,1
3SZYX62S5GCQDA0WFT3O97B4R8V75Z,3SZYX62S5GCQDA0WFT3O97B4R8V75Z, Employers provide 1 hour of financial training per week to its low-wage hires during work hours to instill empowerment This idea directly benefits low-wage workers who lack higher education and aren't able to get out of the cycle of poverty. They end up collecting life-long low-wage checks instead of fixing the root cause and changing their habits or gaining knowledge.The other main player would be the employer who provides the training. If the programs are optional- the attendance rate would not be as high as if the class was held during paid work time. (Benefits listed in next answer) You are who you surround yourself with. Low-wage hires are spending a lot of time with others just like them who have the same mentality and habits. Financial training that is designed to be actionable can change the sentiment of the workplace. Hires will feel 1) accompanied by their colleagues- 2) that their employers care despite the low wages and 3) empowerment to change. The shift in mentality may lead to higher productivity from the hires than the cost of paying for the hour of training. One way to test the idea can be to gauge interest by putting postings of financial trainings that are held during hires' off-hours. -What would be the potential cost for a company such as Walmart to implement this training? -How difficult would it be for a company to be willing to implement this training? -Is in-person training the most effective platform? An individual,2,2,2,2,3
3T8DUCXY0NIWCVZFVMJ6QJ8O2159T4,3T8DUCXY0NIWCVZFVMJ6QJ8O2159T4, What if every social enterprise pledged to hire one man or woman in need for a year program? We want to create a platform that makes it easy These programs will benefitwomen and men who have just graduated from job ready programs through other non profit organizations and can't find jobs. Social enterprises should act as a stepping stone and help introduce them to a traditional workforce. They will be able to learn the skills they need to excel their financial and working knowledge. Social enterprises will also be able to asses their individual strengths for jobs in the future. There will be room for expansion in the private sector This idea specifically uses the power of communities to improve financial opportunities and resources because job experience is crucial in achieving both. As a community it is a small responsibility that everyone can take to change someones life. Organizations like the Downtown Women's Center and Chrysalis do a great job in providing job training and resume building but not every student that graduates from their programs wants to do the work that they have. Everyone has a different dream job. We could survey surrounding small business and social enterprises to see if they would be willing to take on one new employee and for what time frame? is one year too long? how much would they be able to pay them? is a mentorship a few days a week more likely? SOWN is a social enterprise that wants to do this work and not make social enterprises the dichotomy of earning money from one thing- and funneling it to the next. We want to practice what we preach and give women first hand experience. We want to create a program so that it is easy for every social enterprise to hire on or mentor a man or woman in need. It shouldn't be a burden but a joy to give someone the opportunity to learn the skills and open up new financial opportunities and resources. Personal financial tips that you've grown up learning would be so valuable. We would be seeking expertise from the OpenIDEO community in how to create this platform and how to give these women the best tools to move forward. A student project or collaboration,2,2,3,4,3
3TFJJUELSH14QUC5OR91RM0689VC2W,3TFJJUELSH14QUC5OR91RM0689VC2W, Scaling up BRAC's graduation model for the poorest : build an inclusive social network while introducing basic entrepreneurship training This idea benefits the ultra poor. People living below 1.25$ a day are not an homogeneous pool and a unique set ofintervention is required for those in the lowest half of the group who live on 60 to 70 cents a day or less- eat below 80% of their energy requirements despite spending at least 80% of their income on food. The main players would be microfinance institutions who want to extend their reach. This idea use existing structures such as NGOs or microfinance institutions to target the ultra poor and provide grants of productive assets (like livestock) as well as weekly stipends. The aim is to provide breathing room while they learn new livelihoods. The second step is then to encourage participants to save money while providing intensive hands-on training. Itmobilize community to integrate the ultra poor and give them the needed confidence boost. BRAC already runned extensive research about this model- and has demonstrated the success of this scalable- household-to-household approach. Indeed- 75 to98% of participants met the graduation criteria. Evidence also suggests the approach can work outside BRAC's native Bangladesh. The organization is ready to to leverage its experience by working with others Further insights to replicate this idea through different structures.Ideas to adapt this model to the ultra poor in developed countries. An organization,3,3,4,4,4
3TTPFEFXCTWJP36MXLZ5SQEY162H6R,3TTPFEFXCTWJP36MXLZ5SQEY162H6R, Teaching financial literacy in terms that a person can relate to Most of us do not study finance and let's face it- it can be tedious and boring to look these terms up or try learning about them. I think this idea can benefit people who don't want to spend much time or energy trying to be a finance literate. This will make learning financial literacy fun!! Each of us have an obsession or weakness for something. For some it is shoes- for some it is gadgets or books etc. How about which translate all the financial terms into those terms. Say- Person A likes to buy a lot of shoes. So we translate terms like funds- savings- investing - learning how money works in terms of number shoes he/she can buy or is equal to.A mobile application can be built to do this. This would make the entire process fun. An individual,2,2,2,3,3
3UAU495MII4EJVIAXGSYS5PFGEYOUO,3UAU495MII4EJVIAXGSYS5PFGEYOUO, What if you combined the addictively fun life simulation video game The SIMS and the growing financial software industry? This concept would benefit the user by allowing them to navigate those difficult life decisions (specifically financial decisions) in a simulated real-world environment. The main players would be; for example- a large gaming publisher such as Electronic Arts and a reputable financial software provider such as Mint. This could pose an opportunity for these businesses to expand into new markets by providing educational products. A Life Sim gaming environment uses the power of community in two ways. First- in the sense that it takes the strengths of specialists from the gaming industry and the financial software industry to deliver a new product that combines a simulated environment and professional financial advice. Second being the community of virtual people or Sims with whom your avatar would interact and play out scenarios. The quickest and least involved method to get a bearing on the viability of this concept would be to conduct interviews in local communities. Statistics indicate that there is a potential market. By 2013- Electronic Arts had sold 175 million units since introducing The SIMS in 2000. In 2012 Mint topped 10 million registered users. A. Help refining the high level vision (To provide simulated life experiences as they relate to important financial habits/decisions- coupled with professional financial advice) B. Help with strategy- for instance: Is The SIMS idea too lofty? If so- does this idea lend itself to a more manageable scale? C. Gaming- Finance and business expertise D. Design and content generation. Other,2,2,2,3,2
3UEDKCTP9V2TVTLZMG7UBWUMOYQK7X,3UEDKCTP9V2TVTLZMG7UBWUMOYQK7X, Invest in the next generation by pledging money towards students' college funds. The idea benefits students in grades K-12 who need empowerment most. The idea of Marathon Learning encompasses a platform where students can create a personalized profile in which individuals in their network and beyond can pledge money towards their college tuition in exchange for earning good grades. Students from all types of socioeconomic and educational backgrounds could benefit from this idea with the promise that their achievements will be compensated with money towards higher education. This idea would work similarly to how donors pledge money for miles a runner completes in a marathon—in this case the student's existing community is pledging money towards a number of pre-prescribed grades earned (whether those grades are As- Bs- or Cs depends on the specific student). Marathon Learning uses the untapped potential of the student's social network to further their education- and thus allows more students from low-income communities to become financially empowered through school. To test this idea- I could use a high school student in my own network (ex. my 16 year old sister). I would have this student create a private Facebook page that highlights official academic progress- accomplishments- and goals. Then- I would have this student reach out to adults and financially able individuals within their community and social network asking for pledges of money to fund college in exchange for specific grades earned in the next academic semester. I would need help programming this funding platform. I would also need help in ideating on the logistics of collaborating with schools. The platform involves ensuring that the student's grades reported are official according to his/her transcript- that the money pledged goes to a secure source used specifically for college- and that students cannot see each other's profiles. An individual,3,3,3,4,3
3UOMW19E6DIWPRVS6ABZPT3ISJMC5X,3UOMW19E6DIWPRVS6ABZPT3ISJMC5X, A partnership between grocers- insurers- and banks that provides incentives for shoppers to 'invest' in their health with better foods. The main beneficiary is poor families who are at risk of buying unhealthy foods to sate short term hunger. Better food saves health (and money) long-term.Grocers benefit when these customers buy higher-margin foods. They promote the program and provide infrastructure to track purchases.Insurers benefit from customers with improved long-term health- and reduced claims. They will pay forward incentives in an interest-bearing bank account for participants.Banks benefit from new users! Each of these stakeholders -- shoppers- grocers- health insurers- and banks -- plays an integral role in the community. There livelihoods depend on one another. Although the symbiotic nature of their relationships has been short-circuited in many communities- we believe this idea can rewire the circuitry. Every actor is incentivized not only to participate- but also to encourage the participation of others. The greater the involvement- the greater the benefit for each who is involved. The challenge will be to broker the initial partnerships and bridge the gaps of confidence that exist. Will a banker sign on? Sure- but only if they know the insurer will. But the insurer will only agree once the grocer has signaled long-term commitment. And so on. Early experiments would need to involve lots of discussion with each stakeholder. Not only will this help identify key concerns- but it will also engage their thinking in the process before it even begins. Talk to your grocer! Health insurers – what data exist that link healthy eating with reduction in diabetes- heart disease- cancer?Banks – what regulatory hurdles stand in the way of partnerships like this? What impediments do you have to linking reward systems with other vendors?Grocers- food manufacturers – could this type of program integrate with your existing rewards programs? Or would it require completely different IT infrastructure? An individual,2,2,1,3,3
3V0TR1NRVAEQ0TUU8RWYE67GSK64AI,3V0TR1NRVAEQ0TUU8RWYE67GSK64AI, People who are homeless are matched together with volunteers to gain financial empowerment and possibly more An individual,3,3,2,5,4
3V7ICJJAZASVJ3ZME5WU9HRMA2R4BD,3V7ICJJAZASVJ3ZME5WU9HRMA2R4BD, MAKE A LIST and each time you achieve one of your goals // we will contribute for a good deed Youth - and community .education- good deeds not only youth will learn about finance and will overcome challenges- but we will partner with brand to contribute for a good deeds to the communities . Focus group (youth and parents) to learn about their reaction toward the idea ! -Brainstorming how we can make better - anthropology research - social media experts An individual,3,3,4,3,4
3V8JSVE8YY29ODPQD3MRQE1E803EY8,3V8JSVE8YY29ODPQD3MRQE1E803EY8, When women are financially empowered- the whole community wins. This idea not only helps to transform the traditional attitudes among women but also do benefits to the whole society once women could become economic independent.The main player here is the dominance of the women in econmic position. When the women become economic independent- the whole communities could create more work opportunies - resources- and even develop quickly. In Chinese history- the position of women might be lower than men's as the traditional attitudes towards economic independence. However- the perspectives have changed graduallyandwomen become more and more independent especially in the economic aspect even some women may be more powerful in the economic position than men. And the whole society develops quite dramatically with the financial independence of women. Therefore- I think this could be helpful to the community in any other counties. change traditional attitudes between men and women in financial position could be the key to arrange this thoughts. Other,1,1,1,1,4
3W0XM68YZP7FK76XX0QLAM39LCQK10,3W0XM68YZP7FK76XX0QLAM39LCQK10, Transformation from downward spiral of debt trap to upward path of financial inclusion using data analysis At the core of it- the idea benefits MSMEs (ex: small holder farmer in Indonesia - referred as Taman) in emerging markets. Taman is farmer in Indonesia who does not have access to credit. But it will also create value for financial institutions (MFIs and Commercial Banks) and the Government. MSMEs will get loans and saving tools faster- easier and cheaper. Profitability of MFIs would be improved up to 5 times and the Government will be able to meet development targets. TRUST- is a major adoption barrier in the whole process. and close second is education. The idea will use informal networks of the community- informal data exchanged in the community and the existing trust between community member to develop and deliver the solution. Consider small holder farmers in Indonesia- they have community based solutions for agri-info and financial support. But there are ways to improve existing model to achieve scale and impact using data present in current model. An application prototype would be build to deliver on envisioned experience map for accessing financial services. This app would be used to help each stakeholder experience the solution. Farmers will be asked to give information required for solution and key assumption can be tested. The feedback would be incorporated to refine it further leading to a product tailored to specific needs. Providing The existing users of current model can be provided services to test the efficacy of the solution. I believe the solution to promote financial inclusion varies by community. There are a lot of informal models to doing daily activities that vary from community to community. Communities within a country are closely linked- but again vary by current work industry. A better understanding of the needs of farmers and MFIs would in refining the solution further. An individual,1,1,1,1,1
3XEDXEGFX30FDILF1HMLWHKZGKKK0X,3XEDXEGFX30FDILF1HMLWHKZGKKK0X, Please respond to our user needs survey - https://www.surveymonkey.com/s/JZRWF2QMaking the small print legible- accessible and engaging. Increasing financial literacy for loans at the point of purchase by making financial terms and their consequences really clear- accessible and engaging.Primarily focused on unsecured loans with high interest rates (pay day loans- credit cards- pawning agreements- credit to purchase goods or services (like those offered by some electronic / furniture shops- car companies and builders)). Using crowdsourcing mechanisms to help connect people who want to know what the financial implications of taking a loan will be with a community of experts who can clearly communicate that cost. Prototyping Need: Sitting down with someone who might take out a high interest loan to explore (1) their decision making process regarding the loan; and (2) pain points relating to understanding the consequences that fall out of a financial contract. Prototyping translators: Creating a video pitching the idea at the people who would help translate the contracts and see how they react to the idea. Poke holes in the idea- tell me what's working and what isn't.Share your experiences around interpreting financial contracts - what was difficult- what was easy- did you pay much attention to the terms- have any terms bitten you later on? An individual,3,3,3,4,4
3XH7ZM9YX26JWGMNRXEBQ476EG89RR,3XH7ZM9YX26JWGMNRXEBQ476EG89RR, Roma community- students and financial experts will work togehter in desing new tool for simple access to financ. institutions and resources Direct beneficiaries are 1000 Roma and other groups at risk for social exclusion in 4 municipalities in the country with highest percentage of Roma. Their educational level and employment rate is significantly lower in comparison to the national average. Age rage is from 18-62 years. Focus will be given to financial empowerment of Roma women. Also beneficiaries will be young Roma and non-Roma students and financial institutions included in design of the new tool and its implementation. The idea will use power of young Roma and non-Roma student graduates (IT- finance- economics and social sciences)- representatives from financial institutions and direct Roma beneficiaries who will be joint to work together with community Coaches and Mentors in design and development a whole new set of services and tools that will ease access of Roma to financial institutions and resources. The tool will be designed by students- financial institutions experts- community coaches and mentors- and Roma clients in one of the largest Roma communities in the countryTopaana located in country capital Skopje and then the prototype can be tried out in 4 municipalities with highest % of Roma inhabitants in the country (municipalities of Suto Orizari- Chair (Topaana)- Tetovo and Kumanovo) to find out if the proposed manner of support will meet out expectations. OpenIDEO support is needed to identify new innovative ways to revive the traditional channels of communication- such as face-to-face and telephone communications—that are widespread in the Roma community- by adding new features that will make the distribution of information or access to advice more effective and accessible for Roma. The use of new technologies is also needed and will contribute to developing a truly multi-channel access to services adequate for the needs of disadvantaged Roma. An organization,2,2,2,3,2
3Z33IC0JC0YBPN340HJLR1W9ZML9VK,3Z33IC0JC0YBPN340HJLR1W9ZML9VK, A new financial product that leverages credit union communities. Payday loans are a VERY bad finanical product that many resort to in order to make ends meet when unexpected shocks income shocks occur. Customers: Potential users of payday loans- existing users of payday loans. These users are given a lower interest loan than existing solutions.Credit unions: A new financial product that can increase union members liquidity and access to capital. The credit union and its resources are essential to the development of a lower interest payday loan for its members. Unlike banks- credit unions are not-for-profit enterprises with a member first mentality. This means financial products can be developed with the customers interests in mind. Financial structure of this product. I am unsure of the exact impact that a credit unions community could have on creating a substitute product to payday loans - whether it be your reputation within the community that grants you a lower interest payday loan or some element of collateral that you pledge to the community. Could you help me brainstorm this? An individual,2,2,3,2,3
3Z56AA6EK4C5HH7XOIFIKVMUIS1M65,3Z56AA6EK4C5HH7XOIFIKVMUIS1M65, The dollar sign is often used to connote price: the more $s- the bigger the price tag. Let's rethink how we communicate value and costs. This idea benefits all shoppers and service providers. Similar to movie ratings that have guidelines enforcing their correct application- the dollar sign- from $-$$$$ (or perhaps we create new icons) could more expressively differentiate products and services based on their true cost and value. Shoppers can make smarter purchasing decisions when they understand why something costs what it does and what value it has. Services can better differentiate their offerings beyond price point. Film ratings influence movie releases and audience attraction which influences film production by movie houses. An audience's reaction to a simple but differentiating PG or R rating can determine what is bought into and what isn't. Leveraging communities in a similar fashion by making the $ a greater symbol of service/product cost and value not only better helps people understand the true quality of what they are buying- it could also shape that quality over time. We could speak with community members to gain a greater understanding of what $- $$- $$$- and $$$$ means to people. We could also explore different icons to see what visual cues communicate cost and value best. An OpenIDEO Meetup,2,2,2,2,4
