idea, winning, final_feedback
 Using virtual reality to visualize how today's choices affect tomorrow. We want to create an app that helps to connect everyday actions with climate impacts on a personal level.  This idea could potentially benefit every human on planet Earth if it helps to build awareness about climate change and the need for renewable energy. But on a more reasonable scale- interested smartphone users could benefit by becoming more educated about how their daily lives impact the environment. This app could also be brought into schools to more viscerally educate students about climate change and renewable energy.The potential main players are app developers- smartphone users- and schools.  My post doesn't mention a specific type of energy  An OpenIDEO Meetup ,0,0
 Provide solar-powered Tamagotchis to elementary schools as classroom pets with a corresponding curriculum. This will raise awareness about solar power and make the idea of it more established among children and their families.  Solar  An OpenIDEO Meetup ,0,0
 Store energy generated by human activities and provide financial incentives to do so.  High energy users- active people- and people that aspire to be more active.  It provides energy efficiency- cost efficiency and health conscious to communities -- a powerful combination for communities to adopt.  Wire a bike at Stanford's gym  It would be great to speak with someone familiar with energy storage.  A type of energy not listed  An OpenIDEO Meetup ,0,0
 Across the Northeast- hundreds of thousands of buildings still use fuel oil to produce heat and hot water. The collective soot- carbon dioxide and other pollutants that come out of these buildings' smokestacks have dire implications for public health and climate change. In urbanized areas- installing solar hot water systems on residential buildings makes much more sense than PV panels from an environmental- economic- and public health standpoint.The National Renewable Energy Laboratory estimated that deploying solar heating on NYC buildings that burned the dirtiest fuel oil could reduce GHG emission by 260-000 tons- particulate matter emissions by 1-800 tons- and nitrogen oxide emissions by 13-500 tons each year.  Because soot is a known trigger for asthma attacks- installing solar hot water systems in lower-income communities that suffer high asthma rates is particular urgent. Northeastern state and local governments need to eliminate barriers and put in place the right incentives to promote the installation of SHW systems.Our children and our planet will thank them for it.  Solar ,0,0
 It's Airbnb meets PG&E--apply P2P platforms to DERs- allowing individuals to directly sell excess electricity production from renewable energy.Electricity producers will be financially empowered- consumers will have cheaper and more renewable options- and the energy market will become more efficient.The expected outcome is that communities would rapidly transition to renewables as people increasingly profit from the energy sharing economy!  This idea will greatly benefit any community that uses energy from a centralized electrical grid.In developing countries- this idea has the potential to not only drive down energy prices but also financially empower individuals and communities.  By increasing access to cheaper sources of electricity- namely DERs- then communities will naturally pursue renewable energy sources.As the P2P energy sharing economy flourishes- potential producers will increasingly pursue a variety of cost-efficient methods of producing renewable energy in order to play in this market.  Develop the P2P platform and link one neighborhood with particulary low access to renewables with another neighborhood with a particularly high production of renewables.Analyze electrical usage and bills before and after the introduction of the P2P platform.  I'm interested in getting guidance from managers and electrical engineers from utility companies- electrical engineers with experience with grids- electricians with experience in renewable energy- and app developers.  My post doesn't mention a specific type of energy  An Individual ,0,0
 This idea would be be based on a website with the same concept than kickstarter.The idea is that anybody can give money to support the building of a wind generator or a solar panel farm- and then get money back from the production of this unit!  The worldwide community would benefit this idea and the main players are us- the people!  It makes it incredibly easy to invest in green energy as a regular person.  A combination of various types of renewable energy  An OpenIDEO Meetup ,0,0
 To Install Solar Panels Above Roads with Advertisements- which helps to overcome- 2 major issues of Solar Energy Implementation - LAND & FUNDS-It help to Utilize Solar Energy to its Maximum Extent & also able to supply Electricity to each & every place around the world- since roads connects everywhere.  This Idea will benefit- each & every person on this planet-whether its Government Employee or Private Companies Employee or General Public.I mean all 3 sectors - Government- Private Companies & Public.  As we all know- currently solar panels initial installation cost is really very HIGH & LAND requirement is also there- but via this idea- both issue will be solved easily.& this will help each & every 1 on this planet- to gain the benefit of renewable energy- ASAP  Solar  An Individual ,0,0
 Kids have energy. There's no doubt about that. Their favorite part of school is recess and they can't wait to get outside. What if we could use all of this energy to power places in our community- including our schools?Tiger Energy Biscuits- a Kraft company-used this same idea to build a playground. They partnered with a local university in the Philippines- working one year to create a playground that could capture energy used on the equipment to power their local community. This can be even more advanced- using other technology such as energy capturing tiles currently used at stadiums. This is a learning opportunity for kids and become cost effective for communities- and promote a school or business in the process.  The community: The cool thing about this is that it can be placed into any community.A community could plant a park- transform a park- add it to their schools- implement this into malls- theme-parks- anything! Once a community invests the time into making one- the parts and playground can be easily re-created for another location or purpose. If a city just wanted one swing set- they could just start out with that. With the money they save- they could grow their playground and their investment into even more opportunities for reusable energy.The people: Being a college student- I'm always looking for opportunities for projects like this to use my talents and make an impact- and I know I'm not the only one. Schools will want to be a part of this if it gives exposure to their university- and the opportunity for students to have a real-life experience. The kids: When I was a kid- we used to convince my teacher to give us extra recess. I know in second grade I would have so many questions of how the playground worked and why we were doing it. This could even be a fun way for schools and students to compete. They could see which class created the most energy- competing against their friends or even schools competing against schools.The city: This could create so much publicity for the city and others involved- going green is always a trend- and this is a cool way to promote it.  This idea isn't just about changing light-bulbs. This is about creating sustainable playgrounds that can power a city for years and years.Renewable energy- our focus is trying to change and develop things that already exist such as the oil industry- when we should be looking to completely new ideas (like Open IDEO is doing). If people want to have an impact on their planet- instead of waiting on someone else to change their energy- a community can start this on their own. They don't need to wait for a big company or organization- they can start making environmental change on their own!  1. Classes can start the discussion of energy- and start to brainstorm their own ideas and concepts for creating this renewable playground. This is the most cost effective and easiest way to see the potential of this project.2. Communities can host an even- putting things such as sustainable dance floors can be put in place to see how much energy a group of people can actually create! Their interest might start the discussion of putting this in place.http://www.sustainabledanceclub.com/products/sustainable_dance_floor/3. The company Playground Energy uses the energy from children- to create a better playground experience by adding light and sound with their energy used. Even just putting one of these items in place- you can begin to see value in the energy of kids.http://www.playgroundenergy.com/  This idea is good- but it can be something even greater.Post your input on how we can evolve this into something amazing!How can this playground improve your community? Are there any other pieces of technology out there that support this idea? How can we make this already existing idea better? How can this be tied into idea of a power-producing gym?  A combination of various types of renewable energy  An Individual ,0,0
 The Cool City Challenge is a bottom-up organizing strategy to bring cities to deep carbon reduction- starting at the block level. Goals: Enroll 3 cities in 3 years to recruit 25% of households to reduce their carbon footprint by 25%Outcomes:Create social connection and networks around climate changeDevelop demand-side drivers for renewable energy and energy efficiency technologiesBuild political power for climate actionDevelop pathways for behavior changeEnroll cities to cooperate- bypassing the current political stagnationChange consciousnessI am familiar with this project but not involved in the rollout. I will reach out to the principals to see if they'd like to engage on OpenIDEO if there's interest.  The main players are the city politicians and staff; community organizers; block-by-block resident groups; individuals and families  The tools for real community engagement and recruitment exist. This research has been demonstrated as viable and is ready to scale. Once brought to scale- this methodology will engage individuals at the block level to implement carbon reduction strategies- including renewable energy. This is a perfect organizing tool to be added to system designs for community-scale renewable energy. Of then the technological solutions leave out the community-building solutions- which are the only viable pathway for fast adoption.  Some lightweight experiments have been completed. More explanation here: http://www.empowermentinstitute.net/index.php/community/community-empowerment  My post doesn't mention a specific type of energy  An Individual ,0,0
 You are an electricity producing company and you receive thousands of letters/packages to your HQ- social media pressure- media buzz and so on. They are all asking your company- in a polite- non-aggresive and pro-dialogue way- that your company commits to renewable energy producing procedures. They are all coordinated. They are extremely powerful: One for all- all for one.  My post doesn't mention a specific type of energy  An Individual ,0,0
 The SunSaluter (www.sunsaluter.com) is a solar panel rotator designed for the developing world. Using only gravity and water- the SunSaluter enables a solar panel to rotate and follow the sun throughout the day- boostingefficiency by 30%. It also produces clean water!The SunSaluter is built from common components and is 30 times less expensive than conventional motorized panel rotators (called trackers)- and is much more durable without complex components.Solar power is a proven way to alleviate energy poverty- but it is simply still too expensive for many poor consumers. By increasing efficiency and lowering the overall cost per watt- the SunSaluter can help communities afford the transition to clean energy!  The SunSaluter is ideal for poor- rural individuals living without electricity. These individuals earn just dollars a day and often spend more than 20% of their income on kerosene gas and walk hours just to charge their cell phones. Solar energy is a great tool for eliminating these problems- but it is often still too expensive up-front for them. By boosting efficiency and lowering the cost per watt of solar energy- the SunSaluter brings solar energy within reach. For example- a 150 watt solar lantern charging station which powers 75 lanterns can be outfitted with a SunSaluter to be capable of charging 25 more lanterns. The individuals living in unelectrified communities also often lack access to clean water- so the SunSaluter provides a great additional benefit.For example- at the OneMama Clinic in Kirindi- Uganda- a SunSaluter installation has allowed women at the health clinic to not only eliminate the usage of kerosene- but to create a phone charging business to bolster their income.“The mamas are so excited that this is bringing light into an area where they spend the most time- which is in the Kitchen area- and also bringing energy for them to charge cell phones and purifying water- so we’re using it for tea and for cooking dinner. The OneMama Clinic is very grateful to SunSaluter for bringing its wonderful technology to the OneMama Clinic and to Uganda.”- Siobhan Neilland- Founder of OneMama  By boosting the efficiency of solar panels by 30%- the SunSaluter lowers the overall cost per watt of solar energy and simply makes it more affordable. Excellent solar technology is already available in many markets - but cost is still a primary barrier to widespread adoption. The SunSaluter is also unique in that it be installed with new solar systems or used to retrofit existing systems. With over 2 gigawatts of off-grid solar capacity currently installed worldwide- the solar infrastructure upon which to use the SunSaluter already exists- and is growing every day. The SunSaluter is simple to build and requires no special equipment nor training- meaning any community can adopt it rapidly. Lastly- if we can get local entrepreneurs to manufacture and distribute their own SunSaluters- costs will decrease dramatically and hopefully instill confidence in the community to adopt the technology.  We have already deployed over 100 SunSaluters around the world - and every time we learn something new! Regarding outsourced manufacturing- we are beginning to work with a village in northern India where the locals will build their own SunSaluters and can either use them- sell them- or resell them back to us to provide our other customers. We will be making at least 30 systems with them in the coming months- and would really love to learn how to make the process beneficial to everyone involved. We are happy to try any suggestions that people have. And of course we're open to trying this approach with other partners around the world!  We would be grateful for any recommendations on how to set up a human-centered manufacturing and distribution partnership with these communities. What can we do to make sure it is beneficial to the community members- but also ensure standards of quality and reliability for us? What should we make sure not to do? Are there any partner organizations that you recommend that we work with? And of course- any technical or design suggestions are always welcome too - thank you!  Solar  An Individual ,0,0
 Used Kitchen Oil Collection Program is really for anyone. Everybody cooks- everybody fries. And so everybody has leftover used cooking oil and in many cases does not know what to do with it. Only ahandful of countries have a working used kitchen oil collection program and the awareness is still very low. In third world countries and developing countries- often such oil isn't disposed properly because there are simply no means of doing so. By implementing a collection system in such countries- we not only protect the environment a little more- we also help to produce biofuels that can be reused over and over again as it is done in the UK for example.  This program would target local communities of Latin American countries where there is no working used oil collection system. Even if there is two restaurants that somehow recycle their used oil or dispose it relatively safely- the remaining fifty will pour the oil down the drain- which will clog the pipes of the entire building- street- neighborhood- city... Except for the local communities- this will be an initiative for those who are interested in using biofuels in order to either protect the environment- be more cost effective- or both.Strongly suggested would be to target children from elementary school- through high school to university by directly involving them in the program. Why? Simply because the future starts with the children. Educating them about biofuels will ensure their eco-responsibility standards to be higher. And how would this be done? The youngest ones could simply collect used cooking oil from their mom's kitchen and bring it to school that will then hand it over to the collection site. In the case of older children/teenagers- they could participate in the site collection directly as an extra curriculum activity.  Used cooking oil is a very fast way to obtain biofuels. It is everywhere and there is an abundance of it.  The first step in Bogota would be to simply do an on-site research. Talking to individual restaurant and stall owners and finding out how do they handle used oil and if they would be willing to participate in such a program.  This project will definitely need experts on biofuel production- environment safety experts- engineers- educators for the program and anyone who would be excited about the idea.  Biofuels  An Individual ,0,0
 Communities need joyful- memorable & informative material that engages a broad audience to reinforce and celebrate positive narratives around coming together to create a low carbon future- to nourish a sense of ownership and as a counterspell to NIMBYismPut a saddle on a sunbeam Hang a bridle on a breezeRide the tide into the future Land of PossibilitiesThey say: Don’t let ‘em tell you otherwise Those Greenies tell a pack of liesWhen will you people realise It’s all just pie in the skyAnd I say: If the sky can provide Gee- that’s kinda nice of itIf there’s pie in the sky Then cut me a slice of itAKA -Transition Town : The Musical Transition is a bottom up movement- it involves people getting up off their bottoms!  Throughout this project we will be working closely with a number of partners including The Transition Network- Regen SW and number of community energy groups & KEVICC and other local schools and community groups.We also intend to work with other professional musical theatre specialists and amateur dramatics groups and sponsors.Transition network:We will be working with the Transition Network to identify 5 transition groups to visit during the development of the project to explore some of the stories- questions- themes and challenges faced by people as they start to grapple with peak oil and climate changes.Regen SW: Regen SW is a centre for expertise in sustainable energy. For the past 10 years Regen SW has been working with 300 Community Energy Groups to support them in developing their own projects. Through this work- Regen SW has encountered a number of the challenges that we will be considering in the project. Regen SW will be supporting the project with communications and promotional support as well as ensuring that any funds are properly spent and accounted for. Merlin Hyman - CEO Regen SW - Real change always comes from the bottom up- this is about celebrating the communities whose vision could just save the planet. Merlin Hyman - CEO Regen SW - Real change always comes from the bottom up- this is about celebrating the communities whose vision could just save the planet. Merlin’s reaction on being pitched the project that's bonkers: we should definitely do it KEVICC:KEVICC is the largest school in Totnes (1300 pupils) and is the home of The Ariel Centre which has a wonderful theatre space which can seat up to 300 people. The school have offered us space to develop the work and staff- students and the wider community will be involved throughout. Polly Morrow - Community Arts Coordinator'KEVICC has a long produced real quality performing arts shows and musicals- and are thrilled to think that our students might have the opportunity to collaborate with a community project such as this. Especially so as it reflects the links we have- and value- with Transition Town Totnes. It would add hugely to the students' experience and achievement and they are eager to be part of the project.'The products produced during the show will be able to be used by other groups - licenses for use of the music- script and score- films- documentary etc will be available for any group that wishes to engage people in questions about oil dependency and our future energy options - we have already identified 4 transition or community energy groups who have asked to use this material as well as an addition 8 choirs. We think that this materials will be of great help to any community groups who is dealing with these challenges.  One of the central challenges to the development of renewables is getting consent through planning- central to this is the problem of engaging people in the energy debate in a way that is not immediately polarising or negative. We want to raise awareness of the importance of our energy choices within the greater human narrative without the direct link to a specific project to build people's confidence to engage constructively through modelling behaviours- sharing information and creating a positive experience through humour and memorable tunes.  We have already worked with Matt Harvey as out poet in residence for the past 12 months producing a collection of poems which has been bought by 1300 people- performed to wide acclaim to over 8000 people in festivals and events and has recently been filmed and shared online. Poetry in general by its very nature- has a lot of hurdles to overcome (misperceptions about poetry bound and it can often seem boring to the uninitiated) Musicals tend to be more popular and this has been demonstrated with Matt and Thomas's recent show Rumpelstiltskin.We have also been trialling a variety of creative engagement tools an techniques toinvite people in to our activities and  We arecontinually developing creative engagement techniques ad would value any inputWe want to ensure that we produce appropriate and engaging materials that attract people to use the resources that are developed in the projectWe want to ensure that we are linked to networks with an affinity to this activity and that we're aware of other activity we can learn fromWe need financial support to maximise the impact of the project  A combination of various types of renewable energy  An Individual ,0,0
 This multi-media platform serves as a space to share both technical information and personal stories about transitioning to more renewable energy sources at the household level. Professionally produced video content in the style of reality TV episodes will give a glimpse into specific case studies of families who have made these transitions in tandem with details on how others can undertake their own projects. This content will then spur feedback on a forum in which others can comment- ask questions- and post about their own experiences in taking on similar projects.  A combination of various types of renewable energy  An OpenIDEO Meetup ,0,0
 27 years’ worth of worldwide energy consumption equals only one day’s worth of solar energy hitting the earth. While we get more than enough sun to support our global energy needs- the two major barriers to solar energy are high capital cost and uneven sunlight distribution. A global exchange based on solar blocks tackles both barriers. By allowing individuals to adopt solar blocks (or equivalents such as small solar powered stoves) in underprivileged communities with ample sun but little capital- the system creates a mutually beneficial cycle. My sketches below illustrates the idea.  Any community can benefit. Two types of communities can particularly benefit from this. The communities of ample capital but irregular sunlight (ex. a rainy town in New York) can benefit from adopting solar blocks and receiving returns. Also- communities of ample sunlight but limited capital will benefit from the installation of solar generating blocks etc. One example is African communities. Over 85% of the African continent's landscape receives at least 2-000 kWh/(m² year). A recent study indicates that a solar generating facility covering just 0.3% of the area comprising North Africa could supply all of the energy required by the European Union.  The idea addresses two of the greatest barriers to implementing solar energy.  My community in New York doesn't get a lot of sun- but I can set up a simple site- calculate the cost for a solar block or equivalent to put on the site- and see how people react to potentially contributing.  One concern I have is fair distribution within the community. For example- if a community of 50 people gets 5 solar powered stoves- who will get the stoves? Or- how will the stoves be shared? I don't want there to be any tension in the community. I would love to learn more about this kind of social dynamic.  Solar  An Individual ,0,0
