idea, winning, final_feedback
 Most highly populated cities have aging infrastructure systems for water distribution. It is no secret that they will require replacement soon. If we incorporate and leverage sophisticated hydropower technology into the design- we not only renew reliable water supplies to the masses- but also repurposes the flow of water as a generated energy. By appropriately pressuring and re-circulating the water through properly positioned turbines- substantial amounts of energy can be created- stored and/or distributed. By leveraging the same turbine technology in river-based communities - the generated energy can off-set existing power needs and encourage the incorporation and utilization of electric-powered public and private transportation.  Initially- this idea will benefit larger- water based metropolitan areas (and their supported suburbs). As the idea based improvements to infrastructure are implemented- the benefits will be realized by all. The main players include the general population (they must understand and leverage their political representation)- energy regulators and providers- engineering and design firms- and local/national/global governments.  This idea creates greater- affordable access to electricity. This not only increases the demand for the power source- but also a demand for the skill-set needed to facilitate its usage and knowledge of its powered products (vehicles- appliances- etc.). Academic curriculum will adjust to meet the demands of this expanded market of consumers and employers.  The first experiment would be the design and placement of a sample turbine based generator to be placed in both the Detroit River and Savannah River would be idea. Each would be fitted with dashboard to determine how much power was generated and potentially stored. The second experiment would be the design and placement of a pressurized recirculation system in a neighborhood subdivision or apartment complex. The overall system would record metrics of energy generated and potentially captured.  I would love to hear from engineers- energy regulation gurus- current and past power plant workers- and anyone else with insights on this perspective. I also would love to hear from those that may not agree with this approach- as their perspective is just as valuable.  A type of energy not listed  An Individual ,0,0
 Prevent Ebolavand other infections to prevent to replace existing lights with UV enenvirnmemt friendly lights and energy savers  A type of energy not listed ,0,0
 Our Idea is to leverage existent (international) relationships in P2P lending for renewable energy.On the EnergyLend platform- we connect RE Social Enterprises/NGOs- RE Providers- and Individuals who want to have RE-to lenders around the world.On EnergyLend the platform- organizations can start an energy project for themselves and also RECOMMEND potential renewable energy users to EnergyLend.The same goes for Renewable Energy Providers and Individuals: RE providers can start a lending project for themselves- or recommend their potential clients to EnergyLend.We EMBRACE and EMPOWER relationships built around renewable energy.  Where to Pilot?The long-term goal of EnergyLend is to connect lenders and borrowers internationally- but we feel it is probably easier to pilot the project in an area where RE and RE communities are mature. So far- we are still reaching out to different organizations and professionals to seek the best place to start.With the limited time- we are not sure if we will decide on one before the refinement deadline! But we will follow up and make sure we start at the right place!We believe the pilot place will be determined by where the all sectors are most mature and ready for a re-organization of their resources and a display to the lenders.  •It connects the local to the global. •It has a focus on communal renewable energy facilitation and entrepreneurship. •It will benefit communities in every corner of the world- as long as they havegood infrastructure of mobile/online payment.  Any relevant idea is welcome. Do you know people doing this already? Would you recommend some green financial products out there?Would you like to connect us to professionals you know that may help with this project? How do you think we can find our lenders and borrowers? Do you have any idea how to collaborate with traditional finance and to innovate the present micro-finance?  A combination of various types of renewable energy  A Group Brainstorm ,0,0
 Taxis based on Solar energy- Biofuels and Kinetic energy!Two complementary approaches: (1) creating retrofitting kit for existing vehicles (tuk-tuks- taxis and buses); and (2) designing brand new green taxis.  [updated 2/3/15] Commuters have to use vehicles that run on fossil fuels. The only green alternatives are to walk or to ride a bike- but these are not always viable alternatives. With the Green Taxis- commuters have the possibility of using an environmentally friendly and convenient vehicle. It also allows drivers to make a low investment to improve their vehicle- saving on variable costs and attracting new customers. Big cities would benefit the most from this idea- since: 1) would be easier to get veggie oil waste and biofuel; 2) there is a high demand for transportation; 3) these green taxis are much smaller than cars (useful when there is high traffic); 4) tourists will seek will see it as a novel idea.  [updated 2/3/15]The Green Taxis empower people to make choices by themselves. On the one hand- taxi drivers have the possibility of choosing the biofuel they prefer and combine it with other methods (solar and kinetic). The retrofit kit gives them the power to build their own green taxi- buses and tuk-tuks. On the other hand- users have the power choose how commute greenly. This idea helps the whole community transit into renewables since it offers each player incentives to use the product (drivers reduce their variable costs and users breath less pollution).  [updated 2/3/15] The Retrofit Kit is very tangible and can be quickly tested and proven on a small scale whether it has potential to be replicated in other communities. A prototype could be made easily since every part of it already exists: it would be just attaching solar panels to a bus or black receptacle panels to a Motorized diesel bicycle. Using biofuels such as veggie oil has already been proved to work on diesel engines. These kits are both doable and actionable. On the other end- the Green Taxis require more analysis and investment- hence the idea is to find a partner. The lightweight prototype can be made by combining the hybrid motor to the solar panel and the bicycle pedals to combine the energy generation.  Experts in car engines and mechanics.  Electric vehicles  A Group Brainstorm ,0,0
 With the advent of the smartphone- I had a really cool opportunity to witness several health apps come to life over the past few years. Combined with technologies such as smart wrist bands- watches- and other wearable technologies- these apps have helped people lose weight- train better- become more competitive- eat better- and overall improve their health. Apps like Strava allow for spontaneous communities to develop- and then compete. You can post record times of bike rides on certain locations. Other apps allow one to share what food they ate- and allow friends to comment on these actions-- encourage healthy decisions- and discourage unhealthy ones. Imagine if we had an app that allowed for communities to track energy usage- and compete.  This idea benefits any community that wants to start saving energy using connected devices. The main players would probably be Gen Y'ers who are always on their devices and are pretty competitive. The main players in this case would mostly be members who begin using SmarTraq and share their usage data in order to help a larger community gain a better understanding of energy usage and then take action to reduce their usage.  By having a better understanding of how we use energy- we can begin making decisions on how to use less energy and also be more informed as to what kinds of renewables would be appropriate for a particular community. But using ramification- those who were purchasing or using energy from renewable sources- would have that added to their score- so this would be incentive for others to want to compete and try to lower their usage score- and maybe take action to purchase renewable energy in some way.  Developing a prototype app and using it within a local community could work. It would require manual input to be a lightweight experiment- but it could work and give a good understanding as to whether or not the concept would work.  Anyone with experience in app development or energy sharing would be very helpful to help take this idea further. I am open to any suggestions- but ultimately working with people who have had experience in gamification- app development- and energy monitoring or smart homes/ connected homes.  My post doesn't mention a specific type of energy  An Individual ,0,0
 What if there was an accessory benefit to going to the gym? What if a gym- could not only work as a place for you to become healthier- but it also made the environment healthier? The Power Plant...Gym is a concept that uses the kinetic energy often produced by people working out and turns it into electric energy. This power could then be used to run the facility. Excess energy could be exported to the grid- used locally on a microgrid- or maybe used to clean water or air in the near vicinity. More importantly- the gym would function as a way to get people talking about renewable energy and the environment. People already doing this...http://www.resourcefitness.net/http://www.thegreenmicrogym.com/  This could benefit any community anywhere- whether this becomes the central generator of power for an area without power or whether it becomes just a performance art piece for a place with power.  It would help the community of workout enthusiasts reach outward while still working inward (i.e. getting healthy).  I could try and do a senior/ junior design project with local universities to have students create concepts and mockups.  model prototyping of feasible- group-based exercise equipment- would help people to better conceptualize what possible benefits exist.  A combination of various types of renewable energy  An Individual ,0,0
 Sustainability is always seen as an engineering problem when it is in fact a design problem.Sure engineering is part of it- but if a sustainable solution is ugly then it will not have the widest advocacy- nor will it last long and have to be disposed of.It will therefore itself contribute to unnecessary waste.Designers (as well as artists) have established and proven processes and methods for thinking outside the box and increasing the perceived value of a 'thing' or 'experience'.Every sustainable team should include Designers not just as an afterthought - to make it look pretty - but also look at the problem with different eyes and to make for a different interaction with humanity.Human centered design :)  The main players are the engineering companies currently involved in sustainable energy and also the community of designers.They need to come together in a jch deeper relationship than they are presently.As noted above- all communities that have sustainable energy technology in their midst will benefit from this synergy.  If the sustainable energy solution is ugly it will be less widely adopted.Period!  How about a contest among the design community to reimagine what renewable energy could look- sound and feel like?I know this is what OpenIDEO is kind of doing but we really need to engage designers not just sustainability advocates.  Any designers out there?What do you think?  A combination of various types of renewable energy  An Individual ,0,0
 Have a mentor and student funded renewable energy challenge where someone in the field of renewable energy work with environment or engineer students to deploy cost effective solutions. This increase capacity for the students provides a stable partner on the group of the mentor or organization and can be effective first small steps to renewable energy. ***Bonus to the renewable energy challenge could be a development of a mobile app for participants to send in comments and feed back of each project to pick finalist to win some sort of prize.  Cambodia as a least developed country does not have regular access to electricity however is a places were renewable energy could be abundant. Electricity is expensive for the average person to afford and some of the companies have been know to cheat the user to charge them more money. as such if there was constant affordable energy many people especially in rural Cambodia would be happy to use this over regular electricity.  I don't think it would be rapid but progress for a developing country like Cambodia to be able to transition into more sustainable practices especially since population has been on the rise for the past 15 years increasing the need. more over the technical skills to develop innovative technology that goes hand and hand with renewable energy is not available on the scale it needs to be as such to take students who are interested in the field and train them could help in a long term capacity. Along with this the mentors- trainers- teachers- organization etc get an opportunity to develop new partnerships and have access to community based organization etc. This of course is not a rapid or quick solution but in my experience development projects let alone the advancement of new technology requires time to be effective and sustainable.  Go to the university or schools see if there are people who could/ want to participate. also reach out to partners and technical experts to see if they would work with those who are interested.  I really value IDEO human center design approach to solving solution however currently the took kit etc is all in Eng i would like to develop Khmer version and training on this for the participants in this project.as the students develop their solutions to renewable energy I want them to have the opportunity to think about the human context of what they are doing.I also think you have a bigger data based on potential people for students to partner with.  Solar  A Student Collaboration ,0,0
 Bottom up integration: give users reasons to lead the transition into green energies.  This idea benefits a vast number of communities- especially middle class households. Basically- anyone willing to make a relatively small investment to acquire these modular generators in order to save and gain money. Since this approach is centered in the economic benefit of generating green energy- it is not necessary a huge awareness of the benefits of going green.  Because it gives short-term economic reasons for massive adoption of green energy.  We can test if different households are willing to instal solar generator on their roof (or wind trees on their backyard) and connect it to the grid. If they start generating their own energy and understanding the economic benefits of doing so- then it is possible that they won't want to go back to the previous system.  - Better understanding of the technical issues involved - How can different household interact to make the community larger? (instead of thinking the community as different households- think of it as towns or cities)  A combination of various types of renewable energy  An Individual ,0,0
 Taking cue from the pop-up retail shops and gourmet food trucks- can we give Energy a cool- hip twist to engage and educate people in public spaces?  The goal would be to replicate similar installation around different communities- by tailoring the information to what’s relevant to each community. Other than the community members themselves who would visit the public spaces and learn about the ‘energy art’- I hope that the project could benefit local artists as well as local governing bodies who can dissipate the relevant information about local energy use i.e. local utilities.  The idea for this exhibit is to really bring what’s nebulous and conceptual about energy and their relationship with energy to the physical space that they can interact with and learn from. I believe that we can empower people to take action by providing access to information that they can understand and act on. For example- along with the installation- we can have a plaque with information about how they can help their communities such as signing a live petition or read about local initiatives.  A big assumption in this idea is that people will voluntarily interact with a public object- just because it is there. I think one meaningful test would be to have a huge sign in a public space indicating some kind of attraction - to see if and how people would react to a public object. Other assumptions to test with the prototype would be how people behave on social media with pieces of public art and whether energy actions or news propagated here would lead to a change - either in thinking or behavior. We would need to figure out what information should be displayed.  I would love to hear feedback from everyone in the OpenIDEO community; what do people think about the idea- how would you interact with such objects- and what would you want to know more? Specifically- I would appreciate input from people with background in urban planning- fine arts- or local governments!  My post doesn't mention a specific type of energy  An Individual ,0,0
 Ignite. Camera. Action!Reality tv (RTV) doesn’t have to be over-the-top drama and emotional exploitation. But rather...RTV can act as a platform to engage awareness and ignite action! It can utilize the spirit of healthy competition to reach positive outcomes- all while simultaneously benefiting multiple stakeholders: communities- competitors- sponsors- networks- etc.  This idea can also be scaled and applied through global television networks creating their own shows that aim for the same outcome of generating rapid transition toward renewable energy. This can be done by following the same show outline and applying it to a different arena- i.e. America’s Got Talent and Britian’s Got Talent.  Initially- this idea will benefit rural Alaska and the other involved stakeholders mentioned earlier. This idea can be scaled and applied to other communities.  This idea could help my own local community lessen our reliance on fuel for heat and electricity. It would also lessen the footprint of living in rural Alaska and make living there more sustainable.  There have already been RTV shows in rural Alaska -- and they are wildly popular. So- this is a good sign that a show is a doable endeavor. Also- because this idea springboards off other successful shows- it shares key traits that viewers seem to gravitate toward.  It would be fun to hash out more details. This OpenIDEO platform is rooted in brainstorm and collaboration. The more the merrier!  A combination of various types of renewable energy ,0,0
 New idea in cooperation with P2P here: https://openideo.com/challenge/renewable-energy/ideas/green-angels-1The idea is create a platform where the most developed communities in clean energy can be the Clean Energy Angels of other less developed communities with the same characteristics.This angel can provide the other community with advise and events to share their expertise in the clean energy goal. This advise can be for the different key players of the communities: Families- technological companies- utilities- etc.  People from all around the world can benefit themselves from this idea. We just need to create a good platform- easy to use- open to all the world.  As the business angels help start-ups to grow- the clean energy angels community will help other communities that aim to be like them.  First of all we could try to create a mockup website and find to representative communities in the world that can be taken as potential users of our platform. After these we should be able to analyse with some measurable parameters how are these two communities doing in their two particular roles. Angel and start-up  We need people expert in: - Rapid prototyping of services.- User research- Knowledge about the different communities in the world to be able to set a list of parameters that will decide if one community is enough similar to another one.- Renewable energies experts to be able to cross references on the demographics- climate and potential renewable energies for the communities.- Building online platforms- with UX/UI knowledgePlease help us refine this idea and make it possible!  My post doesn't mention a specific type of energy  A Group Brainstorm ,0,0
 The iShares MSCi ACWI low carbon target Exchange Traded Fund (CRBN)invests money globally within an index of companies that have a low carbon footprint.  This idea can certainly benefit potential and current investors who would value an endorsement from a highly respected design institution.Also- companies that actively make efforts to be globally- socially- and environmentally conscious are prime to benefit.Blackrock- a financial institution that understands the balance between fiduciary standards and social responsibility- will benefit as well.  Investing in such a fund creates an acute awareness of companies that are environmentally responsible and is a step in the right direction in supporting them.  I realized that it would be important to gauge people's 'average' investment knowledge because it would affect the resonance of the idea.From what I've come to gather- there is definitely a disconnect- specifically when it comes to the way the money they put into their 401(K)'s is invested.More input to come!UPDATESeems like there is a lot of confusion when it comes to vocabulary around the financial industry- and understandably so! There is tons of it. Also- I get a sense thatfinancial news stories around big names like GoPro and Apple seem to spark the national conversation around economic policy and thefinancial industry.  With the Global Financial Crisis of 2008 and varying faith in the US financial system- I'm really interested in understanding how folks within this design community feel about financial products.Also- given the nature of these products- is this kind of idea too 'business-y' for your tastes?  My post doesn't mention a specific type of energy  An Individual ,0,0
 Why?Capturing the individual´s need to make an impact. The emergence ofthe “reputational capital” as a valuable asset.Pushing sustainable energy solutions to the “tipping point”Create and share an analytics tool that could: 1) Fully internalize the pollution costs (increasing the premium over renewables)2) increase the goodwill (responsible investment trends)3) create awareness; 4) Conneact people- companies to set common goals;For the end customers which would: - Monitor metrics like savings- benchmarks (Horizon 2020)- goals;- Track progress (power of global and external awareness and monitoring);- Predict energy costs on the long run - with different assumptions (as +/-EU ETS allowances- fuel);  Technical matters:a) How to build the right user experience (pretty much by allowing the user to define parameters and other undefined)- or what could be the minimal beta version to test and get feedback...b) How to reduce the number of actins needed for users (think about you mobile online page/banking account- where you have all you purchases- expenditures- etc);c)Level of aggregation (You can aggregate and compare – anonymously - by city- profile- etc)d) How to pull and push data from different sources (best language/tool to use); e) How to use different data and harmonized it- without compromising too much;f) How to keep it simple- but still not falling into redundancies (critical factor too); Critical factors as: A. Better understanding on social networks- or the little we know- to get exponential growth (as user base);B. How would users keep using the tool (or online application- that can be either for mobile- destop version- etc);C. How to make the connections between individuals- companies- government- etc? D. All are part of the same (eco)systems- understanding the links (and nodes and its strength would be important);E. What alternative benefits could be given to end users and companies? This is pretty common on energy efficiency tools; people can save money- check their own consumption- etc.  My post doesn't mention a specific type of energy  An Individual ,0,0
 This challenge faces -at least- two important issues: Funding and Awareness. What if we partnered with the top-of-mind- with billions of users- California-based and environmentally-friendly company? Google and our Communities pursue same ideals with regards to our world so why not combining efforts? And promoting on top of Google would make a leapfrog to our project- don't you think?  My post doesn't mention a specific type of energy  An Individual ,0,0
